標題,日期,內文,讚數,留言數
丹妮婊姐星球,2023年2月2日,巨星我難得要出巡台南了!我要身上帶著我的超級愛牌APM Monaco跟你們一起過情人節!本周日2／5下午 2點 在台南新光三越新天地1樓APM Monaco櫃上讓我服務各位祖宗們～～～～（現在now給我寫去你的本本）不管你單身狗還是有男友的，你周日下午就給我晃滾過來巨星本人很狗，道上有馬子狗這稱號，我表弟妹狗，粉絲狗哈哈哈哈哈哈阿!!!!我會各種滿足你們的需求哈哈哈哈哈哈哈哈!!當店長壓力好大，萬一沒人我就跟工作人員改吃爆台南之旅好了嗚嗚嗚嗚~那天我跟朋友聊到，台灣國民教育，根本該把如何正確理財跟如何戀愛這兩個放到規定的教育裡面，這兩項明明是影響人生最大的佔比的事情!!但學校完全沒教哈哈哈哈阿!真的不用花太多時間在逼我們學碳酸氫鈉與碳酸納的比較!or you know 圓桌幾種坐法!我一直以為我長大後會用到，但都要半百了還是一次都沒用到，比前世記憶忘的還要徹底。如果你想要增進戀愛知識的，我很推薦英國Youtuber Mathew Hussey的影片(但英文要有點能力啦)(他已經死會所以不用想了)有一支影片他在講<如何讓男人對你上癮>，這影片我覺得分析的非常好，大意就是女人要像很涮嘴的零食一樣又鹹又甜，才會讓人想要吃不停，(誰想當那種吃兩口就膩的食物啦!!!)要點大概是務必要跟對像溝通自己的標準，但是用甜美的方式溝通，對自己越喜歡的人越要堅守準則，而不是怕失去對方而把底線往後挪(例如:如果準則是交往後才進房間那就不要改變)然後影片下面有一則留言，她說:拜託~誰遇到喜歡的人還能記得要怎樣講話，就做自己就好，男人會喜歡你就會喜歡。這言論基本上也沒不對，但就跟很會開車的人一樣，你問他到底怎樣路邊停車才能很順不會ㄟ到，他就會回你:看感覺啊!(停超好)靠!我就是不會停啊我感覺都死光啊!!!!同理可證，本來就很會停車的人他真的不用公式，他甚至去日本右駕也能停得很順，但對我這不會停車的人來說，網路停車影片就超重要哈哈哈哈哈阿我就是要靠公式活!!!!所以很會談戀愛的人，你當然可以一路做自己而一帆風順，但今天兩性專家的存在就是為了我們這種不順的人咩!!!馬的要不是打英文太累，我很想幫馬修護航哈哈哈哈哈!那馬修也曾經提過，高價值的男人大多也都喜歡高價值的女人，不管是聰明的腦袋，得宜的談吐，優雅精緻的打扮或生活品味，時尚的氣息等等都是相當吸引異性的~well你也想要是這樣融合優雅、精緻和奢華生活嗎?恩亨一日店長即將帶你體驗~飾品絕對是精緻打扮不可或缺的要素!我超級愛APM的珠寶飾品!!!!!!我之前在泰國走紅毯也是全身配戴APM飾品!日常生活我也超常配戴，你們可以看我影片或ig超常出現哈哈哈哈!這次照片中的都是我自己買來的喔!因為太喜歡了，我陸陸續續都會去逛~~APM的珠寶精緻十足，來自摩納哥的它，像徵著摩納哥，是優雅、精緻和奢華生活的代名詞。同時也很時尚前衛，不同系列的特色融合了街頭/潮流/藝術/秀場等元素， APM 在全球擁有約 300 家精品店 ，在台灣已經是第11家了呢！（台灣人都跟我一樣有品味呢～）希望本周日2/5下午 2點 在台南新光三越新天地1樓APM Monaco櫃上跟表弟妹相見囉這組美照真的折騰到我跟團隊，那天寒流，我真的是已經很不怕冷的人，但陽明山應該比北海道還要冷!!!!好險不是去新竹拍，可能我活動還沒出席就先過世哈哈哈哈哈哈哈!,430,9則留言
丹妮婊姐星球,2023年4月10日,電影幸福綠皮書非常值得一看，讓睡電影大師如我從頭精神奕奕看到尾。我睡過的電影遠遠超過我睡過的男人哈哈哈哈阿! 我對主角那位音樂博士相當嚮往，他就是我想要的那種<做自己愛做的事情賺很多錢，到家也過得很貴族>模板!!他在家穿的也完全就是展現上流貴族的氣場，阿~~~~生活質感人! 如果你也想要成為生活質感人，但我這樣舉男生為開場真的也是很不對，因為今天產品是少女跟gay的哈哈哈哈哈哈哈哈哈哈!好好好換部電影，浮華一世情裡面的女主角 Georgiana，英國鄉下富紳的掌上明珠!今天的脫鞋穿了就是變她啦~~~~~~~~~~~~~~~~ 來自英國的 Laines London 這是我見過最美的拖鞋!!沒有之一!就是最美!!!就是貴族的脫鞋!! 穿上去馬上成為住在倫敦西南近郊河畔的Richmond區，是英國名門望族喜愛的住處哈哈哈哈哈哈哈哈哈哈!這鞋子真的太華麗太貴氣又同時可愛死了!!! 鞋子上那些圖案都是使用高等級珍珠、珠飾和水晶，用印度金銀絲線手工製作而成。 有兩種喔!! Classic Sliders 經典毛毛拖  交叉經典款:那系列是室內拖鞋 看你個人需求，如果你想要回到家過貴族的me time生活，買一雙超美又可愛又好穿的室內脫，真的心情會超級好!! 而且真的很好穿!!我有一雙這種毛毛拖鞋，我在美國買的，真的就是只能叫做矇青(台語)，他底就很薄，我膝蓋有受過傷的人，穿底很薄沒有那種防震感的鞋子，我膝蓋就是會馬上開始麻，對我就是傳說中95趴台灣人都會說的那句話:我膝蓋不好 哈哈哈哈哈哈哈哈我也不願意!我就開過刀啊!! 但來自英國的Laines London，他除了絕美又貴氣之外，他鞋底又輕又舒服，還有很棒的緩衝小防震，又是比較寬版的所以大腳婆如我也很舒服，整雙毛茸茸的真的是像穿棉花糖~~~~~~~~~~~~~~我在家走來走去心情都超好，我就英國鄉下富紳的掌上明珠! 但唯一缺點就是，英國來的，所以貴了一丁點，但~我現在賣你們東西都超級理直氣壯，反正我發現少女省錢不買也是拿去給詐騙集團騙走，或是被男人拐!!!!! 另一款是 Teddy Sliders 一字型拖鞋 泰迪熊毛茸茸款，就鞋面是一槓的 室內室外都可以穿喔!!!!那是兩穿用!所以看你個人想要把他拿去外面穿還是家裡都可~~~(這系列我就穿出去哈哈很美啊) 知名精品品牌很多也有出這樣穿出門的毛茸茸脫鞋，就是出門前先打開中央氣象局的網站，確定今天大晴天到底就是了哈哈哈哈哈哈哈阿!但女孩子為了時髦愛美都可以辦到這點小事情你說是吧!! 這也是可愛慘惹啦~~~~~~~~~~~~~~~~~~~~~到底為何會如此可愛!!不好意思，膝蓋不好的在下，最在乎好穿度，這雙鞋底跟classic不一樣，是特殊訂製的防滑鞋底，緩衝性更強，舒適感也是滿滿~~~~~ 隨時隨地寵愛自己，英國鄉下富紳的掌上明珠丹妮婊姐真的是拜託你們了，錢就是砸自己!!! 每雙鞋上面的別針是活動式的，有貼心附上針線包，也可以固定在任何你喜歡的地方，各式各樣圖案真的會選擇障礙!但一定會找到自己喜歡的，拿來送朋友也超級有心~~ 官網 https://www.stunninrecipe.com/pages/laines-london 加入會員可享會員優惠價並立刻領取$100購物金 結帳輸入婊姐專屬折扣碼”danny” 整單可再打 95折,"1,521",40則留言
丹妮婊姐星球,2023年8月15日,"那天我一個紙片人朋友聊天，她真的是紙片人，但她最近去然給我去抽脂，前陣子還在吃泰國拿的減肥藥!!!!! 你們說亞洲的審美觀是不是要把我們逼死。由於我男友黑豹是美國人，那天紙片人跟其他朋友問我，萬一台灣打仗時我可以逃去美國吧? 我說:不會想，我只想跟家人一起在家鄉生死與共。 但我有些時刻的確會很想移民美國。 他們很好奇地問我:什麼時候? ㄟ，發胖的時候哈哈哈哈哈哈哈哈哈哈哈哈哈阿，因為如果人在美國，就會覺得自己肉一點也還是美國紙片人!!!!!!!!!對我的理由就是如此小!!!!!!!!!!!生死交關我才不在乎!!!!你看看某某某你已經紙片人還在那吃減肥藥!!!!!! 後來紙片人說到，ㄟ上次你丟給我的那髮圈超好用!!!!!拿下來頭髮都不會有很深的摺痕，因為只有一個我整個有夠珍惜。(因為女生有時候吃飯會綁起來吃完會放下來) 喔對，要就自己去買哈哈哈哈哈哈哈!!(後來他真的買了還傳訊給我)恩亨那是我去年代言，我人生最最最愛的德國髮圈invisibobble! 你們可以檢查我yt影片或綜口味，我手上應該永遠都有 #invisibobble神奇魔髮圈，如果沒有就是在我頭上。 身為亞洲的可憐非瘦子，我每一周都固定運動2~3次，最近夏天來到瘋狂一周5次，我熱愛的乾媽原本的髮圈就很好用，但居然還能出新的加強版髮圈，極限運動魔髮圈 ! 如果你有買過原版的<運動魔髮圈>，這個<極限運動魔髮圈>就是顧名思義，更極限哈哈哈哈哈，粗度變成一倍，他是兩條電話線編在一起的概念，所以牢固程度直接大大拉高!!!! 兩款最大差別在承受重量、拉力上 這款品牌重新經SGS測試，拉力，在速率100min/min之下，最大拉力可達30.2 Kg(原版運動魔髮圈25.7 Kg) !!!! 經SGS實測，連續拉扯200次，我用了一個月了真的好用到爆炸!! 更牢固、持久、不易鬆脫!!但一樣拿掉也是沒摺痕完全不會破壞髮型!完全沒有勒死感放心! 適合誰: 髮量偏多、爆炸多、自然捲、髮質粗較蓬鬆的可愛獅子們~~~~~~(頭髮少的建議不用買這款，他有出頭髮稀少的款式，官網有一個說明表!!一定要看清楚才買喔!!!!) 適合場合:日常或一般基礎運動外，特別適合中/強度運動 但這樣不是說原版的運動魔髮圈就不好，其實我用原版的去衝浪狂摔到河中，我高馬尾也沒掉過，我的髮量是中等偏多，我用原版的運動魔髮圈大概要綁三圈才能牢固，但極限運動魔髮圈我綁兩圈就滿牢固了，因為他更緊。我還是都會交替用，就看顏色搭配服裝，看心情，或是做的運動種類來區分喔! 這一次出的款式剛好直接搭到最熱門的女團色 BLACK & PINK極限運動魔髮圈 黑&粉2款色系，共8入只要台幣$600元，比1盒3入款更划算!! 可愛死了啦!!!!!!就是今年最夯的顏色，死亡芭比粉!!!!!!!!!以前諈痛恨死亡芭比粉跟死亡芭比桃，結果今年一瞬間大翻盤，變成最夯的顏色哈哈哈哈哈哈哈阿!可愛得要命!Hi Barbie!!!!!! 但也有最基本安全牌的黑棕色，所以可以穿插運用在衣服的搭配，真的好用到不行，比較牢固但拿下來一樣沒有摺痕!!!!!!我人生再也無法用其他的髮圈。而且他彈性超好，用夜市的電話髮圈，一次就是超鬆弛，需要打G緊雷射。 升級版 極限運動魔髮組 市價1盒台幣$580元，內含最基本黑、白2款共2入，這就是大腸圈的極限升級版啊啊啊!!布料內包裹的正是「 極限運動魔髮圈」 本圈!!可以綁高馬尾的大腸圈已經很少見，竟然還可以綁超高超牢固、各種造型穿越的""不陽痿""大腸圈界大俠在此!! 話說這擺在那平凡無奇，但一綁到頭上，我的化妝師說:ㄟ綁上去好好看ㄟ，超清新又很俏麗!!簡單來說就是功能、顏值都給過，趕快往右滑~啊不是，趕快下單啦! 所以如果你日常、一般運動就直接綁這款極限運動魔髮甜甜圈，但萬一你想要去長時間、高強度的運動，可以再加一個極限運動魔髮圈，先綁好極限運動魔髮圈後再綁極限運動魔髮甜甜圈，你真的跑步機跑個7749小時都不會掉!!!!!!!!!!!!!超牢!!!!!而且完全沒有勒死感!!! 喔對了，韓國現在很流行各種鯊魚夾，小紅書上也一堆時髦鯊魚夾髮型教學，分享完偏重口味的運動款，來介紹日常、氣質韓系女團款的髮飾， 名稱就叫: 魔髮鯊魚夾-愛的豹豹，尺寸大約 長5.5cm x 寬3cm給姊妹們參考，是 #invisibobble 本月新品!! 本尊超可愛!!!!!!一個三百元質感非常的好，完全不是我買過的便宜鯊魚夾!!這樣的價格跟品質完全無痛入手造型UP 德國專研夾扣設計，頭皮不緊繃、配戴舒適不咬髮、一樣沒有髮痕喔! 因為這款比較小一點所以適合一般髮量、少量髮的人，真的超日系的可愛死了，包頭公主頭都可以!然後這款是只有100個，是專門為了表弟妹們開的獨家款式，每個豹紋花樣都不同，主打每個人都有自己的性格與特色，都是獨一無二!!愛的豹豹也諧音愛的抱抱，不只送禮自用都能給頭髮溫柔愛的抱抱，賣完真的就沒了啦!自己下好離手!!!! 極限運動有限時優惠  https://bit.ly/3KwAM9D 婊姐愛的豹豹獨家新品點這 https://bit.ly/45kif8t 如果你真的要買的話拜託拜託看清楚官網的髮圈建議表喔!!!!!因為每個人髮量不一樣~~","2,953",103則留言
丹妮婊姐星球,2023年4月10日,電影幸福綠皮書非常值得一看，讓睡電影大師如我從頭精神奕奕看到尾。我睡過的電影遠遠超過我睡過的男人哈哈哈哈阿! 我對主角那位音樂博士相當嚮往，他就是我想要的那種<做自己愛做的事情賺很多錢，到家也過得很貴族>模板!!他在家穿的也完全就是展現上流貴族的氣場，阿~~~~生活質感人! 如果你也想要成為生活質感人，但我這樣舉男生為開場真的也是很不對，因為今天產品是少女跟gay的哈哈哈哈哈哈哈哈哈哈!好好好換部電影，浮華一世情裡面的女主角 Georgiana，英國鄉下富紳的掌上明珠!今天的脫鞋穿了就是變她啦~~~~~~~~~~~~~~~~ 來自英國的 Laines London 這是我見過最美的拖鞋!!沒有之一!就是最美!!!就是貴族的脫鞋!! 穿上去馬上成為住在倫敦西南近郊河畔的Richmond區，是英國名門望族喜愛的住處哈哈哈哈哈哈哈哈哈哈!這鞋子真的太華麗太貴氣又同時可愛死了!!! 鞋子上那些圖案都是使用高等級珍珠、珠飾和水晶，用印度金銀絲線手工製作而成。 有兩種喔!! Classic Sliders 經典毛毛拖  交叉經典款:那系列是室內拖鞋 看你個人需求，如果你想要回到家過貴族的me time生活，買一雙超美又可愛又好穿的室內脫，真的心情會超級好!! 而且真的很好穿!!我有一雙這種毛毛拖鞋，我在美國買的，真的就是只能叫做矇青(台語)，他底就很薄，我膝蓋有受過傷的人，穿底很薄沒有那種防震感的鞋子，我膝蓋就是會馬上開始麻，對我就是傳說中95趴台灣人都會說的那句話:我膝蓋不好 哈哈哈哈哈哈哈哈我也不願意!我就開過刀啊!! 但來自英國的Laines London，他除了絕美又貴氣之外，他鞋底又輕又舒服，還有很棒的緩衝小防震，又是比較寬版的所以大腳婆如我也很舒服，整雙毛茸茸的真的是像穿棉花糖~~~~~~~~~~~~~~我在家走來走去心情都超好，我就英國鄉下富紳的掌上明珠! 但唯一缺點就是，英國來的，所以貴了一丁點，但~我現在賣你們東西都超級理直氣壯，反正我發現少女省錢不買也是拿去給詐騙集團騙走，或是被男人拐!!!!! 另一款是 Teddy Sliders 一字型拖鞋 泰迪熊毛茸茸款，就鞋面是一槓的 室內室外都可以穿喔!!!!那是兩穿用!所以看你個人想要把他拿去外面穿還是家裡都可~~~(這系列我就穿出去哈哈很美啊) 知名精品品牌很多也有出這樣穿出門的毛茸茸脫鞋，就是出門前先打開中央氣象局的網站，確定今天大晴天到底就是了哈哈哈哈哈哈哈阿!但女孩子為了時髦愛美都可以辦到這點小事情你說是吧!! 這也是可愛慘惹啦~~~~~~~~~~~~~~~~~~~~~到底為何會如此可愛!!不好意思，膝蓋不好的在下，最在乎好穿度，這雙鞋底跟classic不一樣，是特殊訂製的防滑鞋底，緩衝性更強，舒適感也是滿滿~~~~~ 隨時隨地寵愛自己，英國鄉下富紳的掌上明珠丹妮婊姐真的是拜託你們了，錢就是砸自己!!! 每雙鞋上面的別針是活動式的，有貼心附上針線包，也可以固定在任何你喜歡的地方，各式各樣圖案真的會選擇障礙!但一定會找到自己喜歡的，拿來送朋友也超級有心~~ 官網 https://www.stunninrecipe.com/pages/laines-london 加入會員可享會員優惠價並立刻領取$100購物金 結帳輸入婊姐專屬折扣碼”danny” 整單可再打 95折,"1,521",40則留言
丹妮婊姐星球,2023年2月6日,愛情千古難題:喜歡的人忽冷忽熱，表姊我該怎辦? 這題的設定背景我先解釋，這個冷的時期，不是完全消失地表彷彿過世那種，然後突然冒出來很熱情，消失在我定義禮，跟一級謀沙一樣，(故意錯字)終生監禁不得假釋，就是直接此生不用來往。 忽冷忽熱定義是例如這周每天訊息來回聊一天交代祖宗18代，自拍今天早餐午餐晚安，但下周一天一句:哈哈 這該怎辦? 此時會有愛情扛霸子回答:就不要鳥他啊封鎖啊! 如果能這麼簡單就辦到，世界上就不會有這麼多悲情的情歌了，兩性專家全體喝西北風 但如果你能這麼果斷斷連我也是恭喜你，你愛情小博士!!! 或是會有愛情小博士回答:他冷我就冷，他熱我就熱啊! 我偶像英國兩性專家馬修赫西明確說過，這樣只會吸引到錯誤的人，因為有些人很喜歡挑戰冷漠的人，但你總不可能一輩子冷，當你開始熱的時候他就會失去興趣，所以會陷入無限迴圈。 好那到底該怎辦? 馬修有講過對方忽冷忽熱的解方，但可惜的是他把劇情設在對方的冷是消失兩周後突然出現要約。這對我來說不叫忽冷忽熱，這就死而復生哈哈哈哈哈哈哈哈!消失這種就是封鎖請記得。不過馬修的回答還是有一定水準啦，所以根據馬修的解答我調整一下 當對方又<熱>回來的時候，例如約你之類，可以回: 我有點驚訝你會再約~因為最近你沒有什麼跟我連絡，我以為我們要的不一樣。 然後對方霸婚幾爸會說:喔我工作忙我家裡忙~我忙著泡別的妞但別的妞沒空我只好來找你哈哈哈阿哈哈哈 這時就是溝通你的原則的時候 但馬修強調，這話講出去就是要做好失去對方的準備哈哈哈哈哈! 這話講出去就是要做好失去對方的準備 這話講出去就是要做好失去對方的準備 這話講出去就是要做好失去對方的準備 此時要說: 我完全懂你~我最近工作也好忙超累 但我喜歡聯絡能一致的男生~ ㄟ這裡要強調，不是講完保證幸福快樂喔，跟投資一樣無法保證!講完對方可能一樣忽冷忽熱/或是不爽/或是改善，沒人知道。 但一定要大膽但有禮貌地的溝通自己的原則跟底線，這樣男人才會尊重你，男人犯見，他們不會認真愛沒原則的女人。溝通這段話的意思是如果你不能配合，那就是滾去吃大便哈哈哈哈哈哈哈!堅守自己的原則!不要老是用戀愛腦談戀愛! 因為很多人都是愛情第一的戀愛腦，我還見過戀愛命的(所以他際遇超苦哈哈)，就是談起戀愛完全宇宙中心是對方，只差沒把對方照片比照蔣中正掛在教室前面一樣掛在房間，這就是造成愛情滑鐵盧的重要原因之一。 所以說～戀愛絕對不能一頭熱，被戀愛腦衝昏頭～但戀愛中真的很容易失去理智啦momo購物網在情人節前夕設計了戀愛圖鑑心理測驗，欸我覺得準！！！包括：戀愛腦指數、擇偶重點、戀愛習性等，讓你更了解自己在戀愛中的樣子～對！你沒聽錯就是momo購物網，不只要照顧你的生活小事，更要關心你戀愛煩惱哈哈哈哈 這邊測：https://momo.dm/rZrj2n (手機要有momo的app喔!!!) 我做完個人是覺得超準!!!!哈哈哈我戀愛腦指數超低!!!!連註解都好準!!!!但我小時候一定超高，我小時候就為愛而生沒錯哈哈哈哈哈哈!萬一你做出來太高，要多注意啊!!! 歡迎留言分享你的測驗結果～ 而且現在只要分享結果圖到IG還會再抽鑽石項鍊～直接幫你省掉情人節的禮物錢？哈哈哈，不僅如此即日起到2/14還有以下活動： √期間內不限金額下單再抽高鐵假期甜蜜雙人遊 √活動期間內到momo天天簽到最高賺$30mo幣 √每日指定時段狂撒百萬紅包．最高可領到$999mo幣  2/14限定活動如下： √消費滿額可參加幸運轉盤最高送10%回饋 √滿額送麥當勞熱美式 祝大家愛情都能順利，情人節快樂。,841,27則留言
丹妮婊姐星球,2023年9月29日,"早上忙完拍攝後，今天一人開車去遙遠的北海岸潛水，我算是正式第一次一人開車，因為之前旁邊總是會有人。 我覺得今天正式成為新時代女性!!!!一路還能大唱歌一人ktv!!!我真的覺得自己很時髦哈哈哈哈哈哈哈哈哈哈哈，ㄧ人開車去潛水!!!恩我不愧是表弟妹的楷模，我一直以來都是這樣以新時代獨立女性的螢光幕形象在混跡網美圈，我從完全不會開車到今天一人開車去北海岸，這是很帥的事情吧~~我就是很帥的女性!我覺得我真的是表弟妹楷模啊~~~~~~~~~~~~ 我這樣飄飄然自信滿滿地開到潛店旁邊的停車場時(就路邊那種)，入口處，一台車停得非常機八。就是讓入口變超窄比Rose的腰還要窄。 入口呈現一種死亡90度的超窄小通道。 我反覆開了三次，我!完!全!進!不!去!!!!我真的都要撞到那台車了!!!!!!!!!!!!!但我人又在馬路邊後面隨時有來車。如果我人在無人島我真的可以慢慢搞懂到底要怎樣進去，但我不是!!!我要崩潰了!!!!!!!!!!!!!!!!!!!! 我二話不說直接把車丟在路邊(鄉下車不多) 馬路狂奔一分鐘衝到 52龍洞潛水中心    潛水店，阿看到我的教練在遊蕩 馬上用老虎捕捉獵物姿態:你!!!你來救我!!!!!我車子進不去!!!!! 教練弟弟很慌張地說:可是我全身濕濕的ㄟ(剛上岸貌) 誰管你啊!!!!你他媽全裸我也不在乎!!!就是快點來救我!!!!!!!!!!!!!!!!!!! 就這樣綁架教練到我車上(一路說他全身濕的會把我車子弄濕) 不是，這種狀況，誰在乎濕不濕啦!!!!!!!!!!!就算我開的是麥拉倫，我也會沒差好嗎哈哈哈哈哈哈哈阿哈哈哈阿! 弟弟教練很順利的把我的車子開進去死亡90度超窄通道，我猜想他應該覺得這客人煩死人了(他不知道我是誰，我沒有網紅特別待遇哈哈哈哈) 沒想到我新時代女性的第一天，就是把車子丟在馬路邊跑去求救哈哈哈哈阿。 然後回到家停車時，還微撞到我買給光仲的LEXUS哈哈哈哈哈哈哈哈哈哈哈哈哈哈哈哈哈哈哈哈哈哈 我早上那段早安陽光真美好的的新時代女性我很棒那一段，如果是電影的話，就全部剪掉好了哈哈哈哈。 中秋節快樂喔表弟妹 圖文不符 今天太驚恐沒拍照這是韓國espoir 這裡超推得，可以自己做訂製打亮腮紅喔，又好拍好買地址:首爾市麻浦區東橋洞148-14  1樓 서울시 마포구 동교동 148-14 1층營業時間: 11:30~20:30個人訂製產品1.多功能打亮液  售價韓幣23,000元2.眼影盤  售價韓幣23,000元espoir專屬彩妝師為您量身打造個人妝容(*需至官網提前預約)","4,892",152則留言
丹妮婊姐星球,2023年1月7日,我家的狗胖皮小姐最愛的人就是我爸，再來是我，他不太在乎我媽楊邱女哈哈哈哈!她眼裡只有我爸啦!!!我爸到哪她就要到哪! 一開始到我家的時候胖皮真的非常害怕，每天小媳婦感無敵重，但隨著我們一家人的無限寵愛，我以為永遠小媳婦的胖皮也漸漸的賤賤起來! 那天我媽在廚房切熬高湯的排骨肉，胖皮原本在客廳躺著，就飄去了廚房，站在邱女的腳邊盯著邱女看，邱女只好拿排骨肉給胖皮吃，吃了好幾塊。 從那天之後，原本不在乎秋女的胖皮，只要邱女出現，胖皮就會跑到她腳邊徘徊!!!!光仲叫她過來，胖皮來!!過來啦胖皮!!! 胖皮還不過來哈哈哈哈哈哈哈哈哈哈!!!!!居然抵抗聖旨!!!!!以往我爸只喊一次胖皮絕對會過來，我爸的話就是聖旨，胖皮居然完全無視哈哈哈哈哈哈! 搞得邱女很困擾的一直說:沒有了沒有了!今天沒有煮!!(配上雙手空空動作) 到底什麼排骨肉!!!!!!!!!!!!!!!比一堆零食還要強大!!!!!!!!!!!!(因為我們三人本來就會輪流餵狗零食) 要不然就是我在吃飯的時候，胖皮跑到我腳邊(因為零食罐在飯桌) 胖皮等著要我餵她吃，由於考量到她是一個青春少女要顧身材，我說不行啦你今天吃太多了! 此時施光重再次叫:胖皮過來!!不要再去要吃的 胖皮!!過來!!! 胖皮~~~~~~~~~~~~~~~~ 胖皮只盯著我完全不鳥我爸哈哈哈哈哈哈哈哈哈再次無視聖旨!!畢恭畢敬的小媳婦為了吃，聖旨都聽不到了 慈母多敗兒日記下台一鞠躬  領養不棄養喔,1.2 萬,190則留言
