標題,日期,內文,讚數,留言數
丹妮婊姐星球,2023年4月6日,我無意間開始看了日本之前很紅的戀綜<雙層公寓 夏威夷篇>，把不認識的三男三女放到一間透天一起住。我一開始真的意興闌珊，我全部按快轉(我是因為要做功課而看)殊不知越看越好看!捨不得快轉了，根本戀愛課綱!!!太多戀愛實戰!!妮妮月老收穫良多!!分享一段超值得學習的經典片段。一個臉很乾的女生叫雪莉(真的很乾我超想給他一罐精華)，她就很唱邱的跟室友宣布:喔我不想被綁住啊，我只想要自由，我現在需要人脈啊因為我是房仲業者~然後她的魚池當時有三隻魚，俄羅斯人/日本人/有錢人她就分別跟這些人約會接吻調情之類。她大小姐跟日本人出去時很邱的說:喔我還有跟別人約會ㄟ~我沒有想要被綁住，你大丈夫吧?逮就補day蘇~~日本男的當場有點傻眼，我是不知道他內心有沒有受傷，因為他原本滿有誠意的，但他也只能尊重。後來有天雪莉又跟日本男出去喝酒，她就老套喝醉倒在人家懷裡說:我要去你家~~~~~~就真的去了!(當然節目沒跟去拍啦哈哈哈哈哈哈)雪莉當晚沒有回到公寓，所以可想而知發生撞破花瓶的一晚。雪莉隔天一早回到公寓後跟大家說:唉~~~~我可能要好好考慮談戀愛了，日本男好像人不錯，這樣對他不好意思。有夠邱，邱中之邱，我當時還有點羨慕:人夯真好，魚池好熱鬧啊!!!!ㄟ你們知道怎樣嗎?那日本男在那晚後消失。哈哈哈哈哈哈哈哈哈哈哈哈哈哈阿哈哈阿哈阿哈哈哈哈哈!雪莉真的吃鱉的buffet吃鱉到家。我拜託你們一定要從中學習到戀愛知識!第一:可以多認識人，但不要笨到跟對象講你自己魚池很多魚!!你跟別人接吻，你跟別人出去，這就是不用多扯!!!直接大講這蠢度真的是，上帝都會扶額頭。第二:強烈建議千萬不能有唱邱的心理，我不知道為何，超多女生以為玩得起，但最玩不起的就是這票人!!!最邱的人都是摔最慘的。相信我，屢試不爽。說自己是玩咖的，都是最吃鱉的，真正的玩咖都馬說自己不是玩咖好嗎?第三:不是說女生不能主動，我絕對贊成女生可以主動，但也主動得有藝術性一些，雪莉大小姐老用千年老妖1000年沒碰過男人姿態撲上去男人懷裡親，主持群男生看了狂笑。記住，男人是獵人。最後，根據我的職業病，我很愛觀察人的皮膚。我以為她大概35~40歲，我覺得風韻猶存，很有異國情調(因為她是混血兒)，結果她說:25歲我真的綜藝摔，我掌嘴!!!!!!!RéVive『4D水光真精華』適合誰:想要抗老同時喜歡偏向清爽保濕精華的小貴婦們!這瓶真的上市後賣很好是匹衝起來的黑馬，他的那保濕度真的堪比消防隊拿水柱往你臉上噴灑!這瓶用了四種不同分子不同作用的玻尿酸，從封印表層保水度到維持角質穩定，最後提升肌膚彈潤度，再來你看到罐子裡面那一顆顆高水光晶球體，裡面包著高濃度薰衣草精油、白千層葉萃取、荷荷芭油、葵花籽油等多種天然高效植萃保濕成份，化開後就是溫柔的滋潤皮膚，不是開玩笑的保濕，是一種很特殊很像水精華混和一些細緻精油的綜合體!!!直接傾盆大雨灌滿乾枯的曾文水庫!!最厲害的是搭配RéVive最核心的專利更新胜肽(Bio-Renewal Peptide)運用獨家專利仿生技術。我都直接說這技術就是擦的雷射的技術與人體皮膚原有的細胞相同的更新蛋白來加速肌膚的更新代謝，宛如童話中喝下魔法藥水的魔女，皮膚很像投胎一樣我說真的!!!這瓶精華可以搭配之前我最愛的，他們家的英而血霜-光采再生活膚霜，搭配使用不誇張，整個是投胎2次的雙重肌膚效果!!!對了！4/30前到以下網址填寫可以免費體驗水光真精華+活膚霜試用包!!欸這真的送很大方，因為都是他們家明星產品！免錢的不換白不換，有限量喔，趕快去!!https://reurl.cc/vkEqq1最後~我實在對不起雪莉XDDD#4D水光真精華#肌膚水光針 #高光注水秒澎彈 #reviveskincare,"1,252",35則留言
丹妮婊姐星球,2023年4月12日,Netflix的一個韓國邪教紀錄片，以神之名：信仰的被判他真的蠻好看的，我非常想把它看完，但我已經一個月以來只看完一集。為何？因為我真的不知道那些女生到底多！荒謬！！！荒謬到我需要分超多次才能看完一集！！因為會不自覺一直發火！！！！我需要去陽明山山頂噴火（轟焦凍老爸狀態）大綱是韓國一個醜男，他自稱上帝轉世，然後就漸漸地創立了他的邪教，幾萬個信眾跟著他。他專愛高挑瘦長的年輕正妹，他每一晚，比皇上還忙，皇上一晚睡一個，他一晚是要睡很多個，紀錄片還說：他頻繁到蛋都紅腫。然後我就一直在等重點，這些女的怎麼來的？怎麼願意上床？！我要知道啊，以後業配你們我才能業績爆炸啊！其中一個女受害人，她說了她怎麼加入的她有天在路邊坐著，一個女的說他們是一個教會，你來啊～～然後她就去了（？！）這趴也完全沒誘拐，講得好像朋友相約去711一樣簡單。那個教會的園區吧好像是住在那（超大一個園區需要過夜那樣的活動）然後隔天學姐出現，說：教頭要見你！天啊太棒了就把她帶去見教頭，說你要跟上帝上床才能幸福。進去房間後，教頭說：我是上帝就上床了。（紀錄片還穿插一幕是很多裸女在浴缸叫，神～～～快來啊～～～神～～～～～）我真的彷彿被櫻木花道用力用籃球砸頭！！到底是什麼故事啦！我講故事沒有省略，我真的一集滑倒三萬次，故事真的就這樣！這故事到底邏輯在哪啦～～～～～～是不是Netflix怕講太多細節，觀眾會愛上教頭想加入邪教？？照這故事脈絡，以後Tinder約拋哪有約不到的道理，就說自己是神啊哈哈哈哈哈哈哈哈。我真的看得很苦，原本期待聽到什麼精彩洗腦說詞，結果靠，故事跟詐騙集團故事一樣粗糙，難怪詐騙集團可以業績滿滿，原來大家聽故事不講求邏輯……拜託你們看完模仿犯去看這一部啦，然後跟我講後面發生什麼事哈哈哈哈但還是希望受害者快點清醒恢復正常生活（搖醒！！！），脫離醜男,1.1 萬,"1,087則留言"
丹妮婊姐星球,2023年11月9日,那天跟邱女聊到小時侯他都會中午送便當到小學門口給我，我印象很深刻，超級好吃的排骨大便當50元，因為當年我學校的營養午餐真的比餿水還難吃，真的狗也不吃，我不知道這麼多年以後，營養午餐有沒有進步成能吃的地步。ㄟ小時候才沒差飲食控管，能把排骨便當飯不論多多也吃光光，好幸福!!!!!!!!邁入中年後的我人生開始走下坡，悽慘無比，我目前長年吃健康便當，除了味道相當無聊之外，一直以來最不懂為何健康便當跟沙拉明明是烹調程序比較少的事情(又不是說當年那超好吃50元排骨便當要先醃過再炸)，但卻最天價，倒是現在排骨便當都價格都比較便宜。小博士請勿出來跟我說教喔，因為巴拉巴拉巴拉怎樣食材巴拉巴拉，我沒有要聽!!!!!!我就窮光蛋愛嫌貴怎樣!!!!(長年吃太健康導致脾氣很差)我曾經還點過一個沙拉加了一片95元的雞胸肉後變成420哈哈哈哈，我想說試試看到底這麼貴是能多好吃。但我工作真的超級忙，我幾乎每天工作到半夜三點，所以我真的沒有多的力氣自己煮，那天客戶寄了一坨拉庫健康即食包給我試吃，我吃到價格好又好吃的幾樣，來推薦給一些跟我一樣人生悽慘無比的人哈哈哈哈哈哈哈哈哈!【野人舒食】舒肥杏鮑菇 (蒜脆/塔香/麻辣) 丟到微波爐就好!適合族群:飲食控管/外食族/想減肥的/中午帶便當的這杏鮑菇出乎意料的有夠好吃!!!!味道很夠還很脆!!!!我個人最痛恨水煮加鹽巴的任何健康餐(還賣很貴)，沒想到野人舒食這種冷凍包裝居然打趴一大堆現煮的健康餐，真的味道超像吃正常的食物然後味道很下飯哈哈哈哈!超級大推，而且超簡單就丟到微波爐就好!嚴選彰化小農生產直送的優質杏鮑菇然後用舒服去烹煮，大推!!野人舒食也有出很多口味的雞胸肉，但因為我個人非常討厭吃all of雞胸肉所以那天我有拿給紀董吃，他說好吃，飲控族可以參考喔!杏鮑菇這邊逛: https://9vg3.short.gy/bbevVP【鮮綠生活】低卡藜麥毛豆  丟到微波爐就好!適合族群:飲食控管/外食族/想減肥的/中午帶便當的這是另一個牌子，也是意外的烹煮的超像一般的熱炒店味道，超級香辣夠味(但沒有什麼油，也是健康的烹煮)，一吃也是驚為天人再度打趴一狗票現煮的健康餐，可以大口吃但其實不會有負擔，都是健康的東西~也是莫名下飯但寫到這我好像突然要跟健康便當道歉，他就是故意主的狗幹難吃讓你配不下飯吧????毛豆在這: https://9vg3.short.gy/nc6Nmj這些東西都在一個電商平台<鮮拾>可以買到，很多商品附有食品安全認證~但除了賣這些即食料理，他吃喝拉撒從日常生活/家電到保養品全部都有賣啦，就是你人生可以在這裡一站買好，我自己上去逛，很多價格真的很驚人的便宜，可以以試試看到這晃晃!鮮拾雙11共3個會場：科技城(3C家電)、大賣場(日用保健母嬰用品)、菜市場(生鮮食品)菜市場即日起至11/12滿$1500折$100，滿$5000再回饋5%購物金11/10 ~11/11 加碼滿$2000折$150元，活動頁領券滿$5000再贈11%購物金LINE Pay 付款最高回饋500點全站滿＄399免運費新會員註冊送＄50購物金鮮拾賣場: https://9vg3.short.gy/yGPkYD#鮮拾1111爽購節#挑戰全網最低#野人舒食杏鮑菇#鮮綠生活藜麥毛豆,605,18則留言
丹妮婊姐星球,2023年2月16日,"我真的覺得近期被療癒到的時刻是看了灌籃高手的電影，我也不知道我從灌籃高手最後要介紹海洋拉娜保養品大家會不會拿水潑我哈哈哈哈哈哈!不是你們聽我說，如果你小時候一到家就是書包丟著阿姆阿姆吃飯，你打開電視，永遠看到湘北高中對打陵南(不知道為何好像老是都是播這趴哈哈哈)，那是一段歡樂的童年時光，連吃東西都還不用看熱量，想吃八支炸雞就吃好嗎?然後我們長大了，出社會被社會殘暴的對待20年吧，還要再搭配遇上幾段爛感情的摧殘，像那天我好朋友失戀了，身為豬狗朋友大隊隊長我本人，就算隔天一早四點要起床的日子，還是在晚上奔出門，一群女生坐在那陪著朋友哭跟罵前男友。但她還是必須面對接下來很多工作，我苦笑說:ㄟ我當年也是空靈肉身拍片，我只能說我們陪你。人生有夠難，對吧?然後我們這票成人就這樣被迫長大的活好幾年~有天看到了灌籃高手這部電影，開場是五位主角一位位被畫出來，然後一個一個慢慢走下樓梯，最後看到他們拚死拚活，往死裡打就是要贏球的過程我相信看的人都會被療癒了。天啊我們都這麼老了，天啊我們變成不再單純了，原來他們還活著!!(廢話)，原來他們都沒老!!!!!!(廢話)這部電影完全帶著我們回去最純真熱血跟最爽的那段人生日子，煩惱不多，稚氣未脫，為自己熱愛的事情奮不顧身。我們因為長大而忘記了那種美好，這部電影療癒了絕大部分的成人很多，你們有這樣的感覺嗎?如果你很想在這紛亂的社會，在家多一些療癒的儀式時刻，彷彿一個尊貴的公主一樣，你試試看傳說中的海洋拉娜，今天皮膚控制狂用的是兩樣新產品，測試了好一陣子來客觀分析給你們La Mer 海洋拉娜 #高平衡賦活調理露  (咖啡色那瓶)適合誰:皮膚紋理偏亂想要紋理整齊，或想要確保皮膚乾淨才保養的人，當然，享受儀式感貴婦保養感人是絕對適合的。這罐使用的時後要用化妝棉，在做其他保養前確保他可以再次清理皮膚。運用的是新型態果酸和葡萄糖酸溫和的去清理角質跟毛孔。不過不能只把他定位為二次清潔，不然貴婦價位不行哈哈哈哈哈阿阿哈!同時搭配了洋拉娜最經典的當家核心成分海洋平衡發酵精華跟Miracle BrothTM    奇蹟活凝金萃把皮膚從亂七八糟的衣櫃變成美國收納雙天后home edit去整理過的樣品屋等級!我用個人這陣子用起來，我特別有感是帶妝一整天很累後，我當然是會卸妝卸乾淨，但有時候就是因為帶妝太久還是用新的底妝沒這麼適合，反正就真的皮膚晚上看，就亂，我用就用這罐做最後清潔但同時去調理皮膚，連續用好幾天，基本上就會回到原本皮膚整齊的狀態，有一種皮膚變成新的感覺，爽朗有朝氣的皮膚La Mer 海洋拉娜 #深藻煥膚微晶露(綠色那罐)適合誰:皮膚非常粗糙角質很多，顆粒許多，想要膚質從籃球變成水晶球的貴婦們很適合!這罐直接稱為水晶球精華!你皮膚最好顆粒越多越粗，角質越厚的人，持續用真的可以看到自己的臉變成水晶球的嫩度，直接看自己的臉幫自己算命哈哈哈哈哈哈哈 ! 一開始臉很粗可以天天用，後來可以兩三天再用即可~上層：奇蹟活凝金萃油直接來給皮膚好的屏障力量，純煥膚這樣太乾，很像給木頭拋光後上蠟才會亮晶晶~下層：海洋拉娜精準調配多種煥膚微分子酸類，把他們包裹在奇蹟活凝金萃油的微晶球中，所以這樣可以在拋光皮膚的時候但也可以有很優秀的保濕!!市面上代謝的產品也是很多，海洋拉娜特殊之處在當家核心成分的運用，還有把精準的複合酸包在微晶球裡面!而且因為長得太美，還有La Mer的光環，真的用的時候都會自己有La Mer小公主的幻覺。婊姊專屬組合分享：https://bit.ly/40Vxzad輸入折扣碼【Danny】加碼享 超能水 30ml (價值$1,200)2月全新上市 - 高平衡賦活調理露 售價$6,500 (價值$9,162)享限時加贈•海洋拉娜淨瑩潔膚乳30ml•超能修護精華露15ml•海洋拉娜乳霜3.5ml2.居家護理喚活柔嫩禮讚/售價$19,000 (價值$23,460))•高平衡賦活調理露100ml(正貨)•深藻煥膚微晶露 30ml(正貨)•高滲透自律修護乳15ml•超能修護精華露30ml•海洋拉娜乳霜7ml*此為特惠組，恕不累積滿額贈，可享折扣碼及滿萬海洋之心吊飾留言隨你聊抽新品給婊姊妹們試試--高平衡賦活調理露5ml *3名 (FB -2名 & IG -1名)","1,293",43則留言
丹妮婊姐星球,2022年12月5日,喔年底到了，每年這時候我都在煩惱到底要送男友什麼，男生禮物有夠難送，因為他生日跟聖誕節同一個月分，所以下流如我就想就合在一起送一個就好哈哈哈哈哈哈哈哈阿。我會如此煩惱是因為我送過一些東西，我看他也是完全沒在用，就是不喜歡，只是基於禮貌不說而已哈哈哈哈哈!不~~~~~~~~~~~~~~~ 我今年就想說送他電視好了，因為為他的居家生活增添樂趣，誰知道我倆有天聊天，就聊到他為何現在沒買電視，他大概給了我八百種原因，我只好默默去把購物車刪除..... 我後來受夠，毫無美感的直接問:what do you need? 你需要什麼 他說:我真的不缺什麼啊，你不要在那煩惱禮物了，我該買的都買好了。 我下一句問: what do you want? 你想要什麼 喔這句問對了哈哈哈哈哈哈哈哈哈阿，總算給我看了他購物車清單，我挑了一樣結帳送他，毫無驚喜，毫無美感!!!!我的浪漫在哪!!!!!! 而且我也沒有買得很開心，因為那是什麼打電動用的3D眼鏡，對我這金牛座實用大王來說就是我不懂! 我就又想到，啊他最近看感冒醫生，真的隨隨便便噴了美金90元(天啊台灣健保萬歲!!!!!)，所以我又想到那看牙齒肯定貴爆…我想說送他新的電動牙刷，我逛美國Amazon ，跳出amazon Choice，其中電動牙刷是 Oral-B iO9微磁電動牙刷* 這標籤是亞馬遜會挑出評價好價格目前優秀的產品 我看他原本那隻Oral-B 有點舊(不知道什麼型號)，我就想說太好了就買這隻，我自己的iO9 服役一年多超棒，(最近iO7有出新色喔是很美的星空藍)，有了電動牙刷後我真的連出國也帶，我完全不想用手動方式刷牙!! 超級方便省力!! 尤其是出去玩的時候超累就會很懶，電動牙刷真的是救星，而且iO9還有超方便旅行充電盒！ Oral-B iO 系列真的是全球賣超好，熱銷到每17秒就賣出一隻~!!!貴的電動牙刷到便宜的我都有買過來用，因為一開始我也不懂，第一次入手便宜的電動牙刷，真的就是大震特震到腦漿都在晃動那樣，就粗暴大力有夠像按摩棒哈哈哈哈哈哈，後來我用到 Oral-B iO9，我才知道喔~~~~~~~~~~~媽啊，原來震動可以這樣細膩優雅，真的只是專心在清潔牙齒，我的腦漿完全沒有晃動!而且機身設計就是很走質感生活的高級路線 Oral-B iO9幾大亮點整理一下，我真的超愛這系列牙刷，超簡單牙齒刷很乾淨 ● Oral-B 特有小圓刷頭 是根據牙醫師所使用的牙科工具設計，能深入後齒平常刷不到的死角，完整包覆整顆牙齒一顆一顆清潔，達到多清除最高達 100% 牙菌斑的清潔效果+ ● 全球首創^刷毛微震的磁驅動力 比起一般震動方式，這款將能量精準集中至刷毛，跟你說，全集中水之呼吸啦，(不像我之前他牌震到腦子)讓3700根刷毛每一根都在專心微震，溫和呵護牙齦這樣! ● 3重智能壓力感應燈 這功能超棒!就根據刷牙力道不同，有三種不同顏色的燈 白-沒吃飯太小力 綠-剛好 紅-太大力了刷馬桶啦 因為我也是以前都為了把牙齒刷乾淨刷很大力，後來我用Oral-B後一天到晚吃紅牌哈哈哈哈哈，我才知道我以前都刷太大力了，超傷牙齒牙齦!!! ● 16區 A.I. 智能偵測  用3D追蹤偵測搭配AI識別技術，手機 APP 就能專業顯示，有沒有認真刷牙馬上知道!!! ●7大清潔模式搭配互動式螢幕 同時可隨意切換日常清潔、深層清潔、敏感專用、輕柔呵護、鑽白拋光、牙齦呵護、舌苔清潔，7種不同清潔模式你就隨心所欲把嘴巴刷到最ber 亮這樣，還有互動式螢幕給你刷好牙的肯定笑臉，真的是一刷就WOW 不愧是94%受訪牙醫師認為Oral-B iO是目前市面上最好的電動牙刷# 這支牙刷我用了一年多，使用上都很順手，除了刷牙很乾淨之外，(我真的徹底大大降低蛀牙率)真的是時尚儀式感，因為機身整隻做的很像精品一樣，沉浸式回家的一環啊~~~(只可惜我廁所太醜，配不上這支) 有預算考量可以考慮最新出的iO7星空藍，顏色超美，也是送禮好選擇!! 現在入手頂規^iO9 還加碼送四年保固 !!  年底前購買iO系列送半年份刷頭 有興趣的這兒逛：https://reurl.cc/kqnKob #OralBiO #一刷就WOW 年底前購買iO7送半年份刷頭 大家以實際通路公告為準喔！~基於P&G於2020年6月到2022年6月區間在全球35個國家或地區的iO系列電動牙刷總銷售量計算，P&G銷售數據 ^指Oral-B品牌內 #根據P&G委託獨立試場機構於 2020/11~2022/2針對台灣 367 位牙醫師的抽樣調查結果 *iO 微震科技電動牙刷別名 +P&G 實驗室數據，對比普通手動牙刷，根據 55 名受訪者的調查結果,"2,591",55則留言
丹妮婊姐星球,2022年11月22日,今天被兩位名媛跟魔獸歐巴合照洗版，我發誓我真的很想要認真看他們的臉，但真的是靈魂被魔獸歐巴的褲襠給吸走，我完全沒辦法控制自己，馬啊那是大佛嗎?! 因為我男友是美國黑人，我想說他們同種族，所以我真的傳那張片問他:ㄟ那是老二嗎? 他回:對 沒想到下一句補:或許P圖的啦 哈哈哈哈哈哈哈哈哈哈哈哈哈哈哈靠，他寧可羞辱整個黑人種族，也不肯認輸!!!!這不是你們種族嗎!!!!!!!! 馬的雖然他當然不知道賈永婕，但這一看也知道是台灣哪個女粉絲跟魔獸照相，哪個女粉絲跟男明星照像，還幫他修老二，修好才發給媒體啦!!!!!!!!!!!!!!!!!!!!!!!! 到底誰會把NBA球星當假想敵啦!!也太瞧得起我!!!!!!!!,1.6 萬,758則留言
丹妮婊姐星球,2023年9月22日,自從 紀董跟我說什麼誰在海底勞賽的故事，那人的屎不停的從防寒衣脖子那裡飄出來，我聽完ptsd導致我現在去潛水前完全都不敢吃東西，只敢早上喝一杯豆漿哈哈哈哈哈哈哈哈哈我整個下午潛水後到傍晚，真的都餓到懷疑自己已經臉頰凹陷哈哈哈哈哈哈哈哈哈欸我最近生活中遇到一些女生，她們一直覺得周遭一票男生喜歡她們，什麼哪個男的一直找她，她還很為難的要擋。但我仔細一聽，幹，客戶催檔案而已！！！！不要誤會客戶！！！客戶有夠倒楣！！！！！這些花痴真的不能去潛水因為潛水教練在水底多次牽著我的手，超級關心我哎呀是不是愛上我啊～你娘勒才不是，教練只是怕我被洋流沖走死掉他們會倒楣好嗎！！！！（推52龍洞，非常照顧學員）,"3,055",34則留言
丹妮婊姐星球,2023年4月13日,坦白說我從來不知道我podcast收視，但我走到哪很多人都跟我說它們洗澡/通勤會聽，那我只好當作他收視很好可能跟歐普拉秀一樣哈哈哈哈哈哈哈，那我想今天的地球永續小話題就靠你們留言了嗚嗚嗚嗚嗚~ 幾年前去夏威夷long stay時，一個客兄約會約我去浮潛，我想說喔喔好啊，反正我重裝潛水執照都有考到了，浮潛小事啦~看一下就上岸喝一杯蔚藍海岸。 結果殊不知，幹，我誤參加鐵人三項啊，我完全錯估!!因為老外的outdoor咖，他們從事的outdoor都是真的徹底來真的，so我們去浮潛不是岸邊踢踢水看海星，是泳渡日月潭的方式，游到離岸邊有夠遠，我邊游邊罵真心要斷氣，回頭一看，靠，岸上的人跟米一樣小!!!我想說媽的他是不是要把我在海中幹掉!?但哪個交友上認識的人要這麼大費周章幹掉網友啦!!!! 客兄在海中指一個方向，我很不爽一看，天啊~~~~~~~~~~~~~~~~~~~~是海龜~~~~~~~~~~~~本龜~~~~~~~~~~~~~~~他超優哉地在那吃海草(咀嚼的聲音還聽的到) 我幾乎忘記了呼吸，這一切，太美了，游這麼遠，那遍海底風景真的就是海底總動員~~~~~~~~~天啊原來是風景在這!不是網友要暗沙我!!! 那一幕我Dory本人至今永生難忘，烙印在我腦子裏面，都市小土包見到地球的原始美。 後來我開始主持了我的podcast，我每周都播報國際新聞，導致我非常猛烈的一直都在看國際新聞，氣候變遷真的非常嚴重，在世界各地造成很大的傷害，我也是因為這一年播新聞，才真正了解到，地球真的發火了。但永續環保這議題還是~並非熱門啦!!!!(我就從很認真垃圾分類，除濕機的水沖馬桶等等這種小事開始) 很少有美妝品牌願意注重地球永續這樣的議題!!!因為這議題賺不了錢啊哈哈哈哈哈阿! 但天啊~這一次我的愛牌蜜葳Melvita 40周年的重要里程碑，這牌子超注重有機，所以對於地球永續循環更是無比在乎，以實際行動參與協助世界自然基金會（WWF）法國所主導的海龜保育行動!!一起協助拯救可愛的Nemo朋友們~~~~~~~~~~~ 但我也不想攏統的說拯救海龜，還是用點篇幅小小解釋一下到底在幹嘛~ 人類捕魚用的刺網，會讓欖蠵龜可有能發生不小心被魚網困住的狀況。 世界自然基金會（WWF）與當地漁夫們就想辦法當好朋友，雙方基於生態保育的共識，在漁夫的捕魚區和欖蠵龜活動的海灘達成協議，商議放置「海龜逃脫裝置（TED）或是改使用拖網來進行。所以能夠既保育珍貴的欖蠵龜，同時不影響漁夫捕漁擋人賺錢財路。 而另一種赤蠵龜在過去的 50 年裡，族群數量減少了 80%，已被國際自然保護聯盟（IUCN）列為重點瀕臨絶跡的物種。 世界自然基金會 WWF 自 2016 年起更在列為專門保護區的其中一處展開保育計劃。大概是這樣~ Melvita邀請到同樣關注社會脈動的美國知名插畫家 Lisa Congdon，除了人生摯愛堅果油，還有玫瑰美容液、堅果霜，3款都換上海龜插畫新包裝 ~很可愛!!!嗚嗚嗚嗚他們真的本人很可愛，保養時看到他們心情很好，超平和的動物!如果你也是在乎這議題的環保小尖兵，選擇有機保養亦是支持永續愛地球一種方式喔!!我私人影片多次提到它們產品都不是業配。 40週年整個大佛心，讓更多人認識Melvita，暢銷3款經典67折就能買到，全都是海龜包裝!!! 另外再送100%廢棄回收塑膠做成(其中還有Melvita的回收瓶蓋)海龜萬用杯墊，跟植物纖維環保材質的海龜收納包，全台限量賣完就沒了！官網買 https://bit.ly/3MDWUAE Momo買 https://bit.ly/41l04xl,"3,355",73則留言
