標題,日期,內文,讚數,留言數
丹妮婊姐星球,2023年9月5日,我不知道為何fb為何跳出一則呂秋遠大律師的多年前老文章 他一個粉絲問五年前問他的問題 問題如下 呂律師你好，我跟太太已婚近6年，但已經2年多沒同房，感情昇華為親情。最近遇到一位讓我心動的女生，我知道這是不對的行為，也很誠實跟太太討論。我想，感情需要經營，所以想再和太太努力看看，但若到時候還是沒感覺該怎辦？ 太太目前說，她對我還有感覺，絕不離婚。但是我覺得，其實雙方只剩家人般互相關心，我感受不到有任何愛情的成分，我真怕下次又遇到喜歡的女生。 這不是三分鐘熱度，但我不想傷害任何人，除愛情外，房產存款所有一切我都願意給她，因為巨蟹座的她很沒安全感，我真不知如何是好。謝謝律師回答 ----------------------------------------------------------------------- 呂律師的回答在此 已經回答得很好，面面俱到很完整，然後我就看了文章下面的留言 https://www.facebook.com/permalink.php?story_fbid=1962532247121567&id=100000944336615矮額，奧本海默請抵達現場，那下面留言有核子彈，大家怒火很重。 下面很憤怒的留言大概分三類 1這位人夫就算跟新的女人在一起，以後肯定也是會有天<變得像家人>啦，離婚交新的也沒用啦!!! 2哪個女人要跟淨身出戶的沒錢老男人在一起啦~~~ 3 還有些許人妻相當憤怒的說:萬一吼我老公以後愛上別人，小孩歸我啦，去貸款一千萬給/財產全部歸我啦，這樣我才離啦~ 大概是這樣，以上的留言跟心境我完全理解，要是我有老公，他這樣跟我講，我一定也是世界毀滅。 我是不知道那男的到底離婚沒，我完全對他沒興趣，我是擅自想下面留言作回答，我就憂國憂民，因為女人只要抱持著不夠完善的愛情觀，會在愛情裡面吃很多爛苦。 1 說人夫肯定跟下一個有天會像家人，根本不該離婚追求下一個。 這是超多女生砲轟的一點。 這的確是非常高的可能，就算沒百分之一百，也有百分之130哈哈哈哈哈哈哈!就是包準會發生吧我想~ 這在一齣經典韓劇<我叫金三順>裡面其實有一個很經典的答案 長話短說，玄彬就在單身時期遇到了金三順，但白爛的跟前馬複合，但還是發現不行，已經愛上金三順。然後他很誠實地跟女友坦承並且提分手。 女友很憤怒又傷心的說:你知道你們有一天也會變成像我們這樣殞落，你還是執意要去?(跟三順交往) 玄彬安靜一陣子後說:人知道有天終究會死，不也是這樣活著嗎? 幹，先別管我對玄彬的卵子噴發，這答案有夠無懈可擊!!!!  如果你今天要出國玩，旁人說唉呦~~~~喔你終究也要死，也不用去吧!!! 如果你想要創業，旁人說白癡喔~你最後也是死，不用這麼累吧? 想要買房子，旁人說幹嘛啊~死後又帶不走~ 你應該覺得這旁人是在公三小吧? 所以萬一遇到一個男人今天開一個口愛別人，用這去說服他不要離開，真的是留不住任何人，馬的人去樓空好嗎?因為全人類沒人因為知道終究一死而不進行任何事啦! 2 哪個女人要跟淨身出戶的沒錢老男人在一起啦~~沒錢ㄟ~~~~(看衰) 靠，我這是在哪個平行時空，我光私訊就收過超多表妹來信自己遇到怎樣又沒錢又爛的渣男!!!!!!矮窮醜缺一不可。 我講個故事，我朋友交了一個老男人男友，他在2023年8月22號的時候跟我朋友說他這個月到月底止剩下300。我還在那緊張幫他算萬一他5號發薪，他一天能花多少。我很怕他餓死。 然後呢?然後我朋友還愛他愛得要命!!! 最後，簡少年曾經跟我說過他一個客戶，淨身出戶2億，0元跟小三愛相隨去了。 這世界是:很多女人愛錢，也很多女人完全不愛錢啦! 3 還有些許人妻相當憤怒的說:我有跟我老公說啦~萬一吼他以後愛上別人，小孩歸我啦，去貸款一千萬給我啦/財產全都給我啦，這樣我才離啦!!! 發問的那男的是還算好人，願意給錢。最靠北的是不給的，喔對蔣友柏有錢的要命，他也是不給林桓宜。 不給錢是什麼概念? 喔我一個朋友，他放高利貸的，但好死不死他個性超不適合走這行，所有欠他錢的人都不還錢，我這朋友被逼出精神疾病。進出精神病院非常多次，ㄟ我這故事是真的不是我唬爛。 馬的~錢這種東西不是你用叫的對方就會給好嗎!!但如果你要砍你老公我就先閉嘴啦哈哈哈哈哈哈哈哈! 萬一遇到不給的，女生就不簽字，這樣是贏了嗎? 我再講一個故事，我她媽什麼沒有故事最多。我同學的媽媽打死不離不簽，爸爸就喔不簽喔?喔好。 然後以火隱忍者速度搬去跟小三住了，再也不回家，他老子不在乎簽不簽。 所以呢，這樣不簽有贏嗎? 我要講的是，這三種留言，都完全沒有辦法解決事情，或是讓事情往好的方向走。壓根沒幫到那位苦主人妻!!!!(對我真的不在乎那男的) 結果這三種留言最多靠北哈哈哈哈哈哈! 好我在此幻想如果是這位人妻來問我問題:表姊，我跟老公結婚六年，兩年沒打炮。老公說愛上別人，懇求離婚，要求淨身出戶，但我不想離婚，該怎辦? 男人願意給錢時，就是快拿。就跟股票價錢好時快賣一樣，誰知道下周是不是no素? 我永遠記得林桓宜被記者拍到超級憔悴又衣著超樸素，記者很靠北，還說他臉色很暗又髮色不均。 然後下一張照片，蔣友柏摟那小三，記者直接下標:蔣友柏摟火辣女特助 幹，我身為一個女人，我該為林桓宜抱不平的，我都不得不嘴軟承認，那特助很火辣，對不起~~~~~~~~~~~~~~我滿腦都是特助火辣吹喇叭的腦補畫面。 所以，拿了錢，看是要去打鳳凰電波，or去百貨一樓把貴婦乳霜買一run，都可，頭髮染好不能髮色不均哈哈哈哈哈哈!!! 重點就是要變很美又容光煥發，把你的憤恨全部給我拿去變美。療傷部分你要出國療傷還是錢櫃8小或是香奈兒包買個一百萬，都可! 然後~沒有然後，就世界上還有35億個男人，35億隻屌，請你火辣的挑你愛的一隻吧! （或多多品嚐不同隻,"4,931",198則留言
丹妮婊姐星球,2023年7月22日,"我抱著輕鬆無比的心情蹦蹦跳跳的進電影院看芭比，內心大概有了這種電影的藍圖跟想像，就是那樣的歡樂公式可以大笑然後有點小意義。然後重點是重新賣芭比娃娃的玩具。我單純是因為不停的看到馬格羅比去全球首映穿的太可愛，她在韓國首映還拿桃紅色的大哥大啊啊啊啊啊啊啊啊啊啊啊（注意，不是手機哈哈哈哈，是大哥大），完全被她迷倒，全地球唯一適合死亡芭比粉的女人！！要看芭比之前，任何直男都超不想鳥我，我去運動伸展時，我的伸展師說啊周五電影要上了！我說：對，芭比！！！！！（高八度）他皺眉一臉噁心看著我說：不是，是奧本海莫。喔喔喔喔抱歉哈哈哈哈哈哈哈哈，所有直男都超鄙視芭比哈哈哈哈哈哈都覺得超無腦。結果我跟你們說，幹，看完滑倒，電影相當難懂！！！完全不無腦，我到底看了什麼，根本是一部粉紅色的天能！！哈哈哈哈哈哈哈哈哈哈哈哈哈哈哈哈超深奧我的老天，完全不是想像中的芭比電影！！坐我前面是一大票兒童跟家長，我從他們後腦杓就看得出來，他們都滿臉問號，而且最尷尬的是，片中所有笑點，只有我跟朋友奇葩大笑，整電影院從頭到尾超安靜，兒童一次都沒笑，家長也沒有哈哈哈哈哈哈哈哈哈哈哈哈哈，小孩看完是應該不會吵著要買芭比娃娃玩具啦哈哈哈哈哈哈。因為電影的笑點都非常超級美式，外加要微微懂一點芭比小歷史，才能get到。像是電影中狂酸曾經販售過得懷孕芭比，雖然我不太知道整件事情，但馬上猜得到一定是賣超爛，電影中美泰兒公司才會狂自嘲，我們笑到東倒西歪，但全場一片安靜...........（回家查的確是這樣，因為全美狂罵太詭異哈哈哈哈哈，肚子打開一個嬰兒，又未婚懷孕，導致被罵到下架，有興趣可以google，那娃娃太好笑了，到底誰想出來的）這部電影在探討女性主義跟男性主義要如何平衡，但因為台詞滿難，光閱讀中文我都要思考一下背後意義了，我根本也沒空認真聽英文，然後他們就連珠砲的猛講，導致其實我本來就1kb的人完全無法消化，只知道要探討女性主義跟男性主義，然後評論只能寫道這就沒了,因為我太笨沒看懂哈哈哈哈哈哈哈哈哈哈哈哈哈哈哈哈哈哈哈哈哈哈哈哈哈哈。電影中要穿梭芭比世界跟真人世界，不像是以往電影要經過什麼隧道跟空間轉換，芭比電影中，從真人世界，只要到特定海灘，溜直排輪，一直往一個方向溜，然後突然畫風一轉，搭上卡通芭比船芭比火箭芭比車，就可以直接去到芭比世界。我怎麼覺得，有夠恐怖哈哈哈哈哈哈哈，超詭異到不行，跟懷孕芭比一樣相當詭異XDDD可是我還是要說這真的是一部相當優秀成功的電影，從場景到演員到歌曲跟劇本，真的全部完全扭轉［成人對芭比的印象］，對，兒童市場先放棄。因為芭比有各種職業，是創造小女孩對未來的夢，鼓勵女孩擁有未來，但不知道何時開始變成貶抑詞，幾年前布萊德彼特說馬格羅比，妳就是芭比啊，馬格還一臉嫌惡的回：我不是芭比。妳就是哈哈哈哈哈哈哈哈，看完我完全愛上芭比，也非常愛Ryan 飾演的肯尼，一開始劇照出來大家狂酸狂笑但不！！！！他真的把肯尼的沒錢沒車沒工作只有肌肉演的好棒，深情推薦懂美式笑點大人看這部電影，還附送B級片天王威爾法洛喔～圖片是 我好想買的詭異懷孕芭比#芭比","6,720",339則留言
丹妮婊姐星球,2月20日,我正在日本北海道進行我的冬季奧運中華隊種子滑雪選手(自己說)一年一度訓練 全球暖化，北海道超熱，明天可能穿吊嘎滑雪哈哈哈哈哈哈哈我對滑雪的熱愛程度真的跟美妝一樣都是人生第一名的興趣 但因為滑雪場的東西跟美國迪士尼樂園一樣，真的都是可以參加難吃奧運，所以我每天都會在超商買好早餐午餐。 由於我大部分時間飲食控制(當然還是會放風吃美食啦)，所以我就在找日本超商的健康飲食 這些東西通常到日本旅遊都不會吃，因為在旅遊通常每天要大吃很多美食阿姆阿姆，去超商也絕對是買零食甜點冰品，通常都很好吃，但健康飲食我不抱希望的買 一吃，幹，驚天動地驚為天人心臟爆裂!!!!!!!!!!!!!!!! 日本超商的健康飲食有夠好吃!!!!!!!!!!!!!!!!!!!!!!!!!真的吃了會有宮女出來跳女團舞!!!!!!!根本餐廳!!!!!!直接打趴全台灣所有健康便當!!!!!!!!!!!!!!當然也打趴台灣超商的健康飲食!!!!!!!!!!!! 身為吃遍台灣健康便當跟超商健康飲食的可憐飲食控制少女，我大部分時間都了無生趣的吃，尤其是台灣超商的健康食品，真的都是世界末日到荒漠時不得以只好買來吃的難以入口境界(但一般的鹹食像是麻婆豆腐飯或跟餐廳聯名的炒麵倒是做的很好吃) 在此介紹幾個給日後到日本旅遊時，想不開想要吃健康的人參考哈哈哈哈哈哈 711或lawson的鹽味水煮蛋 幹這真的是水煮蛋之神，god of 水煮蛋，地球上第一名的水煮蛋!!!! 明明有蛋殼但剝開後吃起來是鹹的，而且真的是黃金比例的鹹度，又莫名香，完全不知道是什麼黑科技，蛋還超Q嫩，吃的老淚直流。台灣超商的鹽味水煮蛋沒什麼味道，而且浸泡在一個乳白色汁液中，蛋比較沒彈性。 711還有一個醃漬的糖心蛋是韓國口味，幹，god of 醃漬糖心蛋，我分我日本人教練吃一顆，好吃到他隔天為了買這個蛋還連跑兩家711哈哈哈哈阿哈哈哈哈! lawson 的雞健康肉系列 這系列真的神做，真的健康飲食中我自己頒給他米其林滿天星 吃的時候真的會感謝研發人員，他一定好人一生平安，到底怎麼有辦法這麼好吃卻健康!!!!!!!!!!!!!!!!!! 圖片中那些都不同口味，可以根據自己喜好去挑，都超級有味道超級有層次，但熱量低又蛋白質豐富，瞬間讓自己前幾年吃的所有健康餐/健康便當/包裝雞胸肉 全都成為大便哈哈哈哈哈哈哈哈哈哈哈 喔這我個人觀感請勿噴，因為我為了維持身材，付出非常多的心力吃得很健康，但我是胖妹靈魂我超愛吃美食我就女]小衫!!!我只是愛漂亮而犧牲而已!!! 我拜託台灣超商或健康便當，你們想要發下一筆大財，就去把日本超商水煮蛋跟這調味健康雞肉的食譜複製出來，我包準你們賺到股價直接直逼台積電2330!!!!!!!!!!!!!!!!! 日本711 lawson 兩家我也有吃過雞肉蛋白棒系列，都差不多，熱量很低，味道清淡，也滿不錯，台灣711也有賣雞肉蛋白棒但不知道為何熱量是日本一支的三倍，所以我遲遲沒吃過。#hokkaido #ski #japanesefood #japan,"1,334",30則留言
丹妮婊姐星球,2023年5月7日,老是一堆人私訊問我，原本一天三次，現在三個月一次，或是老公每天累慘根本無法回家加班怎辦當然還很多跟伴侶無話可說的～我足足找了2年才有答案！給眼角拭淚的你們（誰要承認）,259,4則留言
丹妮婊姐星球,2023年4月3日,我有一位臉友，她最近狂玩交友軟體，遇到不少詐騙集團所以會po出來讓大家笑。 現在最新舖陳故事是，那男的說:我固定會買物資去某某孤兒院，希望幫助小朋友讓他們健康平安長大。我會買些大米跟牛奶給孩子們吃 (附上兩張在孤兒院照片送禮照片，整段文字因為出現大陸用語，所以確定是詐騙) 那照片應該是P的還是google來的我不知道，但那彎腰陪小朋友的照片，真的越看越火大，聲稱自己是大兵還機長就算了，還拉孤兒院小朋友陪葬，有夠缺德哈哈哈哈哈哈哈哈哈哈阿!他真的是最好被所有嬰靈跟著!!!!!!!!!!!電影鬼店那兩個藍衣服的女孩晚上就去站他床邊啦!!!!!!針的是缺德到極點!!! 但好險這位臉友非常清醒，完全沒有相信!!值得喝采~ 喔然後昨天跟同學們出去聊天講到這件事，他們不懂這麼拙劣的故事線到底要怎樣騙到錢。 由於我一個朋友被騙120萬，一個表妹200多萬一個70幾萬之類，所以我有看過詐騙集團的核心對話，其實核心對話都是愛情的部分。 我就舉例:之前我看過一個對話，苦主是單親媽媽，所以跟對方提自己很沒有自信，覺得自己離婚帶小孩，那男的回，你就是我陳耀天(當然假名)要的女人，我不管別人怎麼看你，知道嗎?小笨蛋(備註: 雙方完全沒有見過面) 由於我是用嘴巴講出來的，沒想到講完包括我自己，全體嘔吐哈哈哈哈哈哈哈哈哈哈哈哈哈哈哈哈! 幹這些話用看的跟用朗誦的衝擊力真的差異很大，真的是噁康才會講的話，我這輩子真的沒有任何一個曖昧對象對我講過:你就是我要的女人  這種話哈哈哈哈哈哈哈哈!到底什麼場合能講這種話啦!!!!這話只能圤序俊說我才不會吐吧!!!! 其實最簡單避免金錢被詐騙，我之前提過很多次的，舉凡提到任何錢相關的事情就是馬上封鎖(貨幣/投資/虛擬貨幣/股票/增加收入等等) 比較難的部分就是甜言蜜語噁康這趴，我之前講過多次，還沒見面就愛得死去活來肯定詐騙，但我發現大家好像做不到，也聽不董。 我在這邊寫，大家一定都笑說天啊噁康怎會有人信? 但我跟你說，我寫成這樣，連我朋友幾個都信了(我想說我朋友圈應該更能被我影響，看來我影響力超爛哈哈哈哈)噁康真的當道!!!!!!偏偏女生都很吃噁康這套!!!這套廣受歡迎。 自封地下月老的妮妮我本人，我左思右想，總要寫出一個什麼吧? ㄟ抱歉，連我也真的想不出來要怎樣教少女如何對詐騙噁康免疫，因為我天生M屬性，我生來討厭甜言蜜語哈哈哈哈哈哈!很像問黑人怎樣rap一樣，他哪知道啊就天生!!!! 我就去問我友人鳳姐 鳳姐說: 欸我覺得你應該先探討為什麼女生相信噁康，因為他們覺得自己就是紫微啊幹，我們沒有覺得自己是紫微好嗎? 所以免疫應該就是先覺得自己不是紫微，也不是韓劇裡面的醜女大翻身好嗎，因為軟體上那男的也不是蘇志燮啦! 幹，上面這段我聽得懂，但我真的不知道少女懂不懂，因為連我本身私生活，就有好幾個紫微朋友!!!!!!! 所以拜偷表弟妹幫我想想了~這題有夠難!!!(順便cue各路道上兩性專家來拯救錢多的少女們) #兩性 #兩性關係,"6,622",349則留言
丹妮婊姐星球,3月12日下午9:01,上週跟助理去日本出差，這次出差是請助理訂房間(備註:有時候出差並非客戶訂飯店)，我們抵達之後，房間就跟照片呈現的一樣，很大，是塌塌米房間，我每次到飯店都很喜歡趕快看一眼廁所，我喜歡檢查廁所很美好的感覺。我就把牆壁上所有的拉門一個一個拉開，我一直在打開大雄房間的拉門概念 打開都是跟大雄的房間一樣，裡面都放棉被~然後~~~~ 然後就都棉被哈哈哈哈哈哈哈哈哈哈哈哈哈哈哈哈哈哈哈哈哈哈 幹我有看錯嗎?!這麼大一間房間，居然，裡面沒有廁所?????????? 很像老二超大但沒精蟲我崩快地跑出房間，看到走廊盡頭，是公用女廁，然後洗澡還要下樓公共洗澡區 我先不管洗澡的問題 馬的我半夜起床尿尿，還要先糾結走廊有沒有女鬼!?!?!?!?!?!!?!?!?!?!?!!?!?而且萬一我想大便怎辦????隔壁間聽我交響樂?? 我先聲奪人的說:我不是難搞，我已經中年婦女了我沒辦法過這種少年人宿舍生活阿哈哈哈哈哈哈哈! 我叫助理當下馬上找那一區剩下的飯店房間，條件超簡單:房間有廁所飯店有電梯!!!!!我必須立刻要烙跑! 我立刻打給客戶請他留步!!(她剛剛才送我們到飯店) 拜託回來載我們!!!!!我的房間沒廁所!!! 客戶說:喔!!!蔡哥跟你們住同一間飯店，他剛問我日本飯店費用會退款嗎?難怪他剛剛還問我婊姐要在這住幾晚....... 我想說，蔡哥這麼紅，應該很賺阿，他怎麼如此親民跟勤儉持家住在宿舍風旅館???真是一個節儉的網紅~~(跟助理誇讚他)但看來是晚上去尿尿時走廊遇到女鬼，蔡哥也想烙跑了嗎?? 然後助理火速訂到飯店後，我們又很辛苦的把全部行李全部再搬運到樓下(對，還沒有電梯)，我安慰著自己，嗯!今日達成減肥醫生對我的期望，勞動量很大。 上了客戶的車，透過客戶跟蔡哥聯絡上，我實在太好奇他是不是半夜尿尿時，走廊遇到女鬼，所以也想烙跑。 沒想到蔡哥在電話上回答:不是女鬼，是這旅館洗澡的地方，超小，大家距離超近，一個極小的浴缸，然後大家肩並肩泡在一起，浴缸旁邊就是淋浴的地方(我內心幻想小丸子他家浴室)，結果這裡都台灣人，我洗澡時被認出來說:ㄟ你是蔡哥嗎? 哈哈哈哈哈哈哈阿哈哈哈哈哈哈這是什麼畫面哈哈哈哈哈哈哈!那要是我硬住下來，就是直接給粉絲驗貨我的隆乳。 我說:ㄟ那這樣不就粉絲知道你樓下尺碼了??應該不會漏氣吧!!! 蔡哥回:喔因為現在是冬天，所以膨脹係數沒有很夠... 哈哈哈哈哈哈哈哈哈哈哈哈哈哈哈所以隔壁打招呼男生看到蔡哥樓下很小我到底聽了什麼故事哈哈哈哈哈哈!所以他回房間會跟朋友宣布蔡哥尺碼哈哈哈哈哈哈! 後來我跟助理烙跑到火速下訂的飯店，標準就是房間有廁所，飯店有電梯。標準低到好像是擇偶條件是，只要是男人，有份工作。 結果我們逃難來到了時光隧道，穿越到50年前，昭和時期風的飯店，我第一次在日本坐到冷冰冰的馬桶，因為他沒有免治馬桶哈哈哈阿哈哈哈!這機率真的也是日本製的壓縮機啦哈哈哈哈哈哈! 兩小時候的深夜，客戶傳訊息來:報告，蔡哥也要烙跑了~ 哈哈哈哈哈哈哈哈哈哈哈!!當然要烙跑!!這樣每天洗澡壓力多大!!!跟粉絲玩檢查身體的遊戲，難道要等到半夜沒人時才能洗嗎?????要是我可能還要縮小腹洗澡，還不能吃晚餐。 後來隔天工作時遇到蔡哥，蔡哥說:我其實有先自省我是不是難搞沒辦法吃苦?但看到你烙跑，我也就跟著烙跑了~ 我說:你真是一個好人，因為我劈頭就對助理說我不是難搞!但請你現在給我找有廁所的飯店!我完全沒有自省哈哈哈哈哈哈哈哈哈哈哈哈哈哈阿哈哈! 結論就是:蔡哥人品很高尚，樓下尺碼未知圖片 既然跌倒了不要浪費，那睡一下好了,"6,937",134則留言
丹妮婊姐星球,2023年3月10日,自己揭開黑歷史照，（以防萬一以後被別人起底哈哈哈哈哈哈哈）唉呦威這隻影片可以鎖男友不要讓他看到嗎！！！！有這功能嗎？我以前真的醜到助理跟寶光哥一直驚呼，完全不顧他們是領我薪水的人哈哈哈哈哈哈哈只要好好保養，有點預算醫美並行（我沒動刀），也可以換一張臉哈哈哈哈哈，跟我一起倒著活本集乾媽HR黑繃帶乳霜真的自己非業配影片也講過超多次非常好用！（他需要提什麼？）啊~~還是要來幫大家重點整理一下如果你真的想要追求全方位的抗老跟修護或是你醫美術後想要快速恢復的話靠著黑繃帶30%的普拉斯鏈你可以感受到他非常強大的威力雖然貴 但完全對的起他的價格真的是我心目中零缺點的抗老修護乳霜!!現在乾媽來寵粉再加碼了現在只要到赫蓮娜櫃上購買黑繃帶修護乳霜或是玻尿酸抗皺緊緻精華 (任一正貨產品，含特惠組)，結帳時再出示我的貼文截圖，就會再多送玻尿酸抗皺緊緻精華5ml!加碼活動還可以與母檔預購會活動並行，先幫大家總整理赫蓮娜母檔預購會活動：1. 事先報名繳預約金送奢寵預訂禮2. 會員再送專屬出席禮3. 五大明星品項加碼贈寵粉截圖購買送小針管5ml 活動只到2023/4/6，每個人就1次機會，每櫃只有限量30組!先買先贏!快來一起體驗零缺點乳霜：http://bit.ly/3KUk3y2 Helena Rubinstein 赫蓮娜 #HR赫蓮娜 #黑繃帶乳霜 #分秒緊膚 #抗老緊緻 #繃出年輕肌 #輪廓線,"2,663",132則留言
